step_id,page_name,runtime_ui_status,allowed_actions,disabled_actions,result_semantics,report_status,export_status,formal_executor_connected,notes
1,Project Home / 项目首页,implemented_gated_ui,"view workflow summary; view Data Readiness / Analysis Readiness / Gate Summary; navigate target flow","formal DEG; ORA; GSEA; KM/log-rank; Cox; clinical association; report generation; export","no formal result; project state preview only","draft / not_ready","disabled_missing_report_ready",false,"UI-C2c implemented project summary and gate overview; Project Open / Developer Preview wording replaces Active/Completed claims."
2,Data Source / 数据来源,implemented_gated_ui,"select/configure preview for GEO; TCGA; GTEx; Local File; view recent imports/state preview","download GEO/TCGA/GTEx; real local file import; External Result as main card; analysis actions; result generation; export","registered/imported preview only; not formal input readiness","draft / not_ready","disabled_missing_report_ready",false,"Only four main source cards are visible; legacy Local Import/GSE/Chinese search remain diagnostic-compatible rather than primary runtime path."
3,Data Check & Preparation / 数据检查与准备,implemented_gated_ui,"view readiness table; copy/check summary preview; proceed to Group & Design when eligible","Save Report; standardization report export; formal quality score; formal analysis run; result generation","preflight eligibility only; no formal_computed_result","draft / not_ready","disabled_missing_report_ready",false,"Readiness rows cover expression matrix, sample annotation, clinical data, gene mapping, batch/platform, missing rate, and outlier detection."
4,Group & Design / 分组与分析设计,implemented_gated_ui,"edit/view group draft; comparison draft; covariate/design summary; gated preflight preview","formal model run; formal DEG; report/export; treating ready_for_preflight as formal result","preflight_only / design_draft; not formal_computed_result","draft / not_ready","disabled_missing_report_ready",false,"Group setup and comparison/covariate switches remain draft/preflight surfaces with formalActionEnabled=false."
5,Analysis Tasks / 分析任务,implemented_gated_ui,"view task gate matrix; view DEG parameter review; view preflight checklist; copy/read task readiness summary","Run Formal DEG; ORA; GSEA; KM/log-rank; Cox; clinical association; Generate Plot; Add to Report; Export Result; visible task write/preflight/formal run actions","preflight_only; resultSemanticKey=preflight_only; no DEG table; no fake plot","draft / not_ready","disabled_missing_report_ready",false,"DEG/ORA/GSEA/KM/Cox/Clinical Association matrix exists; ordinary UI does not enable formal executors."
6,Result & Report / 结果与报告,implemented_gated_ui,"view result/report gate preview; view preflight log; view empty result; view imported/testing preview when present","Add to Report; Generate Report; fake result table; fake plot; report-ready transition","testing_summary_only / preflight_only / imported_external_result preview only; not formal_computed_result","draft / not_ready","disabled_missing_report_ready",false,"UI-C2f split step 6 from export; imported/preflight/testing outputs remain non-formal."
7,Report Export / 报告导出,implemented_gated_ui,"view export gate; view format readiness for DOCX/HTML/PDF/CSV/XLSX","Generate Report; DOCX export; HTML export; PDF export; CSV export; XLSX export; report-ready package; file write","no formal result available for export","draft / not_ready; not report_ready","disabled_missing_report_ready",false,"All format controls are disabled/gated because formal result, report-ready package, and export adapter are missing."
